ID,Text,Label
1,i wouldn t say i feel homesick really but i miss being in the circle knowing what is going on in the family having that sense of community,sadness
2,i feel as if im being too needy and unworthy of care,sadness
3,i let a few people read a few pages when i m feeling rotten about my work and need encouragement,sadness
4,i used to be a bright light i used to shine the way but im fading every day im just crooked teeth and bad tattoos thats all ill ever be to you and i feel so awkward in my skin we all live in the shadows of the statues of our former selves,sadness
5,i know i know its riveting stuff sorry for the lack of effort this month but i have a feeling no one is all that disappointed,sadness
6,i open it i feel like it was empty,sadness
7,i go there whenever i feel gloomy,sadness
8,i feel i m the one being abused here mentally,sadness
9,i found myself feeling rather ungrateful,sadness
10,i dont know that well ever resolve our differences on earth but i feel less burdened with a need for it,sadness
11,i feel unimportant a trifle the brume of society,sadness
12,im feeling a little bummed and ignored right now,sadness
13,i have been feeling kind of lame at work lately,sadness
14,i was feeling so miserable that i wanted everyone to feel that way too,sadness
15,i feel terrible for elizabeth fechtel,sadness
16,i began to feel more and more emotional i decided it was time to just turn off all the lights darken the room and spend time healing resting and mourning with only my husband to see,sadness
17,i don t feel as troubled and stigmatize as i felt i was so the site doesn t really reflect me anymore,sadness
18,i guess what im saying is that ive gotten way more self conscious about blogging than i used to be and i feel ashamed of that,sadness
19,im starting to feel the abused child syndrome again,sadness
20,i actually enjoy my job because i can do it for free however i feel my passion is suffering because of my career confused,sadness
21,i lie in bed or is it a coffin it feels more like a coffin not altogether unpleasant just very still i push my legs together and cross my hands i try not to cry i sink downwards hoping for a prick a poke a tube of fluid a needle of,sadness
22,i hear the swish and feel the bite of this whip as she swings it against my unprotected balls making them dance with every lash,sadness
23,i might hate feeling awkward and encumbered and stretched and sore all the time,sadness
24,i see leaders friends people i look up to strangers in the faith all loosing their lives and i honestly feel a bit discouraged,sadness
25,my girlfriend left me,sadness
26,i believe you will be here with me to assist me in staying strong and courageous throughout all the trials struggles and issues and i praise you for not allowing me to be afraid or feeling discouraged if things don t seem to be progressing in my time,sadness
27,i feel shitty for no real reason and then i get even more upset at myself for feeling that way,sadness
28,i was feeling quite beaten up,sadness
29,i know in my logical head i have absolutely nothing to feel sad about but i feel it anyway,sadness
30,i refuse to feel ashamed because i wasnt aglow in the joy of doing halloween for the fifth time,sadness
31,i hated the fact that i cried for someone who didnt deserve my tears and i hated the fact that i have become a weak person by feeling helpless,sadness
32,i feel ashamed of and purely disgusted by,sadness
33,i have been feeling low,sadness
34,i wish i didnt feel the urge to transform myself to hide the pain to dwell on what ifs i find it more than a little tragic that i know exactly the things i am doing wrong yet i cant seem to muster enough motivation to alter them more than what suits my comfort zone,sadness
35,i feel awkward around amp about them perhaps not the poems but the collections they are it feels as if vain author is always opposed subsequently by a recondite governor by which time its too late,sadness
36,i feel like i have been punished by the shunned for not being part of the group,sadness
37,i have a feeling i m not alone in that,sadness
38,i feel humiliated and embarrassed,sadness
39,im feeling groggy sleepy yet i cant sleep,sadness
40,i feel so worthless in your eyes,sadness
41,i feel like i win when i lose waterloo i was defeated you won the war waterloo promise to love you for ever more waterloo couldnt escape if i wanted to waterloo knowing my fate is to be with you waterloo finally facing my waterloo knowing my fate is to be with you,sadness
42,i are both feeling in such a way that we are completely and inevitably defeated,sadness
43,i have been crying a lot and feeling kind of depressed,sadness
44,id pronounce it as the f word or as yeah depending on how i feel that day i have a dirty mouth i know but i consider myself outspoken and not afraid of saying what i actually think,sadness
45,i cant feel jaded about keegan anymore because he needs to learn his own lessons and if we lose each other in the process well deal with that as it comes,sadness
46,i started this blog to first help me deal and maybe touch someone feeling as hopeless,sadness
47,i do not know how a lot of occasions they beat that drum but i feel like it was beaten a little as well heavily,sadness
48,i feel pretty resigned to the fact that unless hes willing to step up his commitment level im not willing to put myself several states away to just live with him without any promises for a real future,sadness
49,i feel quite boring but there s nothing exciting,sadness
50,i watched myself go through the motions the way i responded to the collapsed feeling in my chest and the unpleasant scratchy constricted feeling in the back of my throat,sadness
51,i admit sometimes i feel defeated by the symptoms,sadness
52,i feel hopeless to resolve these issues,sadness
53,i feel devastated and help hellip,sadness
54,i can t help but feel disturbed and almost wronged when i feel somebody s doing something inappropriate with their lives,sadness
55,i dont know why i feel so gloomy and wretched these days,sadness
56,i feel like im lost ive never seen them in years and its awful,sadness
57,i feel awful because i see her eating in mr,sadness
58,i said earlier don t you feel me is all about the emotional mind games none more so than sarah making jason watch as she tries to make jessica bone another vampire,sadness
59,i am feeling like my goal is a little lame in comparison,sadness
60,i feel that is how low i feel due to my weight,sadness
61,i know kame is feeling troubled over the decisions he made last year,sadness
62,i woke up feeling a little groggy but so rested,sadness
63,i make mistakes or feel as if ive acted out of line or let go of too much information i feel shamed,sadness
64,ive still not completely got used to ashs new working pattern i feel a bit lost at night when it used to be time for us to sit down and relax put our feet up and watch the tv hes still off at work,sadness
65,i feel sorry for the people about to lose their jobs,sadness
66,i feel guilty because i know that i am being unappreciative of what ive already been granted with,sadness
67,i didn t enter the random tournaments because i was too busy playing casuals in the other room but i heard plenty of hakans popped out on the selection screen which made me feel a little regretful about not entering,sadness
68,i feel sexually abused,sadness
69,i start feeling whiney and sad and poopy just like children when the feel bad,sadness
70,i feel ignored abandoned betrayed,sadness
71,i feel so guilty for putting my child in daycare,sadness
72,i have no flexibility goal in mind i just don t want to wake up and feel miserable every single moment of every single day,sadness
73,ive had days where i feel defeated,sadness
74,i feel like it title share on stumbleupon stumbleupon a target blank rel nofollow class reddit href http reddit,sadness
75,i want to read again because i feel that because i read those in college or thereabouts there is probably so many things i missed in those novels,sadness
76,i feel so disliked sometimes,sadness
77,i was feeling incredibly drained and while it may be viewed as a weakness i am learning to recognize that it is imperative for me to take the time to let god love on me and fill me up because without that time i m not going to last,sadness
78,i spent most of the movie shaking my head and feeling slightly embarrassed for the people who actually spent money to produce this film and for myself for sitting down to watch it,sadness
79,im feeling defeated and making up excuses,sadness
80,i feel deeply pained due to the pain i must have caused you,sadness
81,i want people to feel unwelcome and like they cant sit down anywhere,sadness
82,i feeling unloved,sadness
83,i feel awful tummy from my period and my head from last night,sadness
84,i also have been feeling pretty lousy on the days after consuming even moderate amounts of wine so i don t think i can really have more than a glass and need to make sure it s on the weekend so i m not incapacitated during the week,sadness
85,i was feeling very lethargic and thought it would be a good idea to go for a run,sadness
86,i could feel the aching in my back,sadness
87,three weeks ago a friend of mine bid me goodbye before going abroad i felt happy for her as she was achieving something by making the trip,sadness
88,i cannot help feeling that now i am fake i am not who am i really is,sadness
89,im feeling particularly lame today,sadness
90,i feel a little empty being back as most of my friends have graduated already and i dont have my work colleagues keeping me company anymore,sadness
91,i put into thinking about this person and guiding this person if that person doesn t respond i can feel like all of my labors are in vain,sadness
92,i feel like i ve complained about the aching legs an awful lot lately,sadness
93,i have a feeling my college life is going to be doomed,sadness
94,i feel so at fault it is horrible,sadness
95,i feel a bit low and one of my remedies for that is comedy,sadness
96,im feeling very remorseful at the moment,sadness
97,ive been pretty slack with updating my blog as ive been busy and feeling groggy however i am back to my usual self now the last two weeks have been pretty jam packed so im not going to go into loads of detail else i will be here for hours so i will just bullet point whats happened,sadness
98,i have heard so many times that being there is enough but when it is someone who is so close to you you cannot help but feel helpless,sadness
99,i was not feeling beaten down and slightly broken after the sequence of the last or so months,sadness
100,i feel more and more listless,sadness
101,i thought i was doing really well amp have been buying a few items or just on a certain item of food but then last week i spoke to my friend who has a complete one year supply amp i feel really discouraged,sadness
102,i feel shitty about it why do i do it,sadness
103,i feel whiney lol,sadness
104,i occasionally lose my frame and begin to feel low status,sadness
105,i made my hubby a valentine mix and now im feeling all sentimental and stuff,sadness
106,i guess i should allow for do nothing days but why why why did they have to come first making me feel doomed for the rest of it,sadness
107,i squirmed against it but the pain was starting to get to him so he stopped feeling resigned,sadness
108,i have been so twisted up frustrated feeling dumb put upon rushed had things to do places to be i want to sleep until thursday it is just all too much,sadness
109,im feeling is just groggy and after i were to pop that lethal tiny yellow pill which is like about mm in diameter it makes me all drowsy and ill just die in bed,sadness
110,i feel less jaded or more enthusiastic now,sadness
111,i certainly left feeling a little bit like a character from sex and the city but less needy and way more awesome,sadness
112,i can sit behind my computer and type and weep and say all kinds of things because there is no one right in front of me to feel embarrassed and vulnerable in front of,sadness
113,i feel mournful yet joyful when my journey leads me to an old road being taken back by the earth,sadness
114,i feel like watching another movie but u noe i m broke so i think i will have to postpone my plan,sadness
115,i didnt go feeling kinda regretful right now,sadness
116,i feel really needy right now like i could talk a friends ear off,sadness
117,i feel a bit dull,sadness
118,i mentioned in my previous post i was feeling pretty rotten after that mile hike last saturday,sadness
119,i umenyiora feels disrespected facebook a rel nofollow target blank class share delicious href http del,sadness
120,im feeling awfully disturbed today aucs as u can see,sadness
121,i feel even more useless because i cannot get that person back i cant even get him to talk,sadness
122,i want to tell him so he doesnt feel like he missed anything but i dont think he thinks he needs a replay of every event,sadness
123,i feel damaged and broken over this and i have been for so long,sadness
124,i sit quietly trying to get other work done but feeling largely useless,sadness
125,i still need to write lilah s two year birthday post and i m going to backdate it because i feel like a neglectful mama but i wanted to post a few cute photos from her birthday party,sadness
126,i have a great life an easy life and as ever i feel a little stupid about my doldrums,sadness
127,i feel like i am being punished a class post count link href http littlecyndilou,sadness
128,im feeling rotten today a href http www,sadness
129,i feel beaten,sadness
130,i cant help but to feel embarrassed for both myself and the school for the reputation its starting to get as being hostile towards blacks asians and other minorities,sadness
131,i am feeling heartbroken all the same,sadness
132,im dealing with are not the end of the world but ive been battling so much that i just feel drained ineffective and done,sadness
133,i have so many people around me and yet i feel alone,sadness
134,i feel on the inside pretty crappy and i am finding i dont think the outside is looking so hot either,sadness
135,i feel devastated with the situation that i have placed you,sadness
136,i feel horrible that i am questioning him and his wisdom part of my catholic upbringing i guess,sadness
137,i am also grateful for the reminder that i cant feel sorry for myself and be grateful at the same time,sadness
138,i hate it i know i can feel but when you love it you know its not real no and i am resigned to this wicked fucking world on its way to hell the living are dead and i hope to join them too i know what to do and i do it well,sadness
139,i left brakpan police station feeling disheartened,sadness
140,im feeling a little sentimental tonight,sadness
141,i feel like such a neglectful mother i know its all just for attention,sadness
142,i am trying to get at has nothing to really do with feeling rejected but the way people go about doing it,sadness
143,i suddenly crumble and get immediate feelings of being disliked or bad,sadness
144,i woke up with a gut feeling of being so guilty,sadness
145,i feel as though all of my characters are boring too mainstream or just,sadness
146,i just feel so disillusioned about singaporeans and their mind our own business attitude that has already crept into our subconcious and become the way of life,sadness
147,i feel like he was miserable because im happy,sadness
148,i feel alone all the time and he just happened to be there,sadness
149,i feel like a messy drawer hats been straightened up,sadness
150,i am feeling like a bit of a dull fucker at the moment,sadness
151,i need no stamps or degrees to feel valuable enough to qualify for and participate in society,joy
152,i feel very privileged to be mingling with them,joy
153,i became happy after i found god or i was so unhappy until i got god into my life i believe in god i pray i m a good person most of the time but i have this void emptiness horrible feeling lately and how come i m not as happy,joy
154,i feel adventurous,joy
155,i am apparently feeling inspired and i posted two shared topic ideas on the a href http www,joy
156,i even had time to make some freebies last week as i was feeling very generous,joy
157,i couldnt stop myself and started feeling joyful and hopeful inside as pilate turned to the crowd and said i can find no fault with this man,joy
158,i feel comes from dave that s really cool lessard said,joy
159,i didnt have a bum knee i d feel more triumphant more like a real athlete maybe if i d trained harder i wouldn t be feeling this way,joy
160,i am blunt only because i feel that someone should be told something in a truthful way,joy
161,i feel pretty lucky to have it in my house,joy
162,i guess it feels virtuous,joy
163,i can say i feel very satisfied watching this,joy
164,i giggle away it just feels so cute,joy
165,i do not want to feel superior again,joy
166,i think i ve grown up a certain stage in me and somehow i feel these poems as a return in the past and not a pleasant one,joy
167,i am feeling so joyful this morning,joy
168,i feel like a princess so so gorgeous,joy
169,i feel more confident and less socially awkward than i have in years,joy
170,i liked just talking to someone and that butterfly like feeling you get when someone is sweet to you and it just felt nice to be noticed again,joy
171,i was feeling invigorated free light i wasn t thinking about anything,joy
172,i reflect on my life i feel nothing but contented,joy
173,i used to love love love dressing up and going to parties and having a spooky time but this year just feels mellow,joy
174,i find myself very sensitive to what she feels about me and with that i withdraw a little of my playful nature,joy
175,i don t feel as happy as i thought i would,joy
176,ive become in a mere years yeah right o but i really just feel so eager for it all,joy
177,i only need to crack open a volume and instantly i feel reassured that things will be alright,joy
178,i feel righteously virtuous that i work a full schedule plan and cook organic meals for my family weekly visits to the farmers market do the laundry ok with a little help from k manage all finances and keep a clean organized house,joy
179,i have absolutely no reasonings why i like you so much i know that there are many others who dislike and try to tear you apart but there is a special something that i feel within you and i am always delighted when you respond to something of mine,joy
180,i didnt feel pain and it felt pretty comfortable,joy
181,i feel special now a dir ltr href http fireblossom wordgarden,joy
182,i there its wednesday and i am feeling giggly today because of the artist that i am featuring today a href http www,joy
183,i am slowly realising is that because i don t count the housework shopping cooking and child transporting as productive activities i am rushing to do all the things i feel are more worthwhile in between these tasks and i am actually feeling under pressure to meet my own unrealistic expectations,joy
184,i feel like if you shop smart you can still add a few things here and there to your wardrobe without breaking the bank,joy
185,i am standing in my oversized tee shirt baggy yoga pants pulled up hair already semi sweat streaked from spin and am trying to feel graceful and sexy,joy
186,i do feel this years pinnacle design is an improvement from last years i am not thrilled with it,joy
187,i ask questions to feed their egos to make them feel really smart and important,joy
188,i got a wig but i feel like everyone is looking at me but its really cute and kinda blonde,joy
189,i feel like that s divine intervention that we met because i met him as a manager,joy
190,i made them come visit us here since they are lonely at home i didnt feel that festive mood that i always felt back in malaysia when i see those decorations and listen to the new year songs being played in the shopping malls,joy
191,i feel like all the carefree i had is tainted with a double meaning somehow,joy
192,i feel like portal is a bit of an homage to being a smart nerd and that endears it to me quite a bit,joy
193,im feeling and recently saying no took a lot courage as there are a lot of cool stuff going on but its making me feel better,joy
194,i feel peaceful right now,joy
195,i guarantee you will feel glamorous if you do the gloves then focus on your heels and a wonderful black beaded pair of earrings,joy
196,i find i have a mixture of conflicting feelings sadness that it is all over glad that i had the opportunity to spend time there and perhaps disappointment that we couldnt make it work in the timescale,joy
197,i feeling hopelessly rich,joy
198,i suppose its a lack of feeling special,joy
199,i am feeling the need to consolidate to step back and re evaluate the purpose of this blog other than providing a fabulous vicarious life for yall to live through my sarcasm does not always come across in print,joy
200,i am much more aware of my own limitations now than i was three years ago and i no longer feel at all sure that we are prepared for another child who has bigger needs,joy
201,i am feeling ecstatic for several days now,joy
202,im feeling eager to get back on the elliptical,joy
203,i also value then i would feel ok about giving thousandth of my salary to that same charity,joy
204,i feel like my creative juices are gone,joy
205,im really not feeling too keen on these things,joy
206,i will discover what it feels like to look for alaska through the eyes of one very talented brother and founding nerdfighter,joy
207,i chose vain beauty initially i wasnt very keen on vain beauty because when i called the lady who answered gave very curt answers which made me feel that she wasnt very keen on doing my business,joy
208,i was feeling pretty smug because i met my challenge a href http lindacraftycorner,joy
209,i feel as tho i am over eager but im not gonna fight it,joy
210,i feel excited or not,joy
211,i love the colour and i feel really glamourous when i put it on,joy
212,i knew that she was dying about a year before she actually left us and so i spent almost half of the last year of her life with her and had some great heart to heart very honest talks with her that allow me to feel peaceful now,joy
213,i will feel carefree,joy
214,im just not comfortable at home because no one who can make me comfortable and feel valued,joy
215,ill be doing to make myself feel virtuous,joy
216,im now on my second martini and feeling fine,joy
217,i am feeling excited about my new channeling crystals sided face with an isis face also,joy
218,i feel honoured that finally the iranian authorities recognised my effort to promote the persian cat as a mayor player in science and research,joy
219,i am going to wear the yoke and ruffle skirt that makes me feel gorgeous,joy
220,i am definitely feeling the heat of having my wedding follow such a gorgeous ceremony and reception so closely,joy
221,i shook my head and kept walking feeling quite smug that hed never guess,joy
222,i didnt feel too smart after that but i did feel proud,joy
223,i dont know why but i dont feel contented,joy
224,i could feel her jump at all the bangs which was so cute,joy
225,i write this i realize that it may sound that i am feeling quite virtuous about my morning s efforts and sounding quite impossible,joy
226,i feel judging from my blog content i must at times come across as quite snobby because i prefer classics over a lot of contemporary fiction,joy
227,i feel that many are not in substance elegant but very filling from the supreme good heart,joy
228,i have dance my school work money problem i dun need no more problems worrying about you worrying about my feelings for u i have assured u time and time again,joy
229,i feel in a funk because there is not one single area of my house that is pretty acceptable enough for me to photograph and put on my blog,joy
230,i feel might be useful to teachers and administrators who work with refugees,joy
231,i always am when charged with creating art because i just don t feel i m all that artistic,joy
232,i know second time but i feel like it with another picture showing the artistic side of me,joy
233,i feel privileged to do life with her,joy
234,i channeled a lot of my own wit in my last posting i m just not feeling the humorous spirits tonight errr early evening pre staff meeting,joy
235,i feel pretty cute in them too,joy
236,i just love knowing that soon i am going to be able to have a sunday where i am not totally bummed that ill have to go to sleep early d for me the best feeling is waking up to the sun and being carefree,joy
237,i do feel like im working towards my goal now and feeling more relaxed and content with my life even more,joy
238,i feel that it s vital that people have ample time to express their views,joy
239,im feeling positive right now though because i decided to jog even though i usually end up so disappointed in how awful i am,joy
240,i feel so much energetic when i know them,joy
241,i just would feel more convinced it someone in business said so,joy
242,i just want to pay my bills doing something i feel is valuable,joy
243,i was feeling fantastic per my post on january th,joy
244,i feel extremely satisfied serving the poor free of cost said dr,joy
245,im feeling happy today hahaha,joy
246,i feel like thrilled or something like really happy,joy
247,i just forgot about the disappointment feeling because i was not accepted just i f you read this just think about it as something that i wanted to tell you just so you will remember those times,joy
248,i get the cold and then wear it on my face for the rest of the month during which i have to endure people repeatedly asking me if i feel ok because you look terrible,joy
249,i feel honoured to have this mona piece chosen to be put on a large,joy
250,i have readers i feel like i need to write or say something worthwhile something that will keep their attention and maybe even make them smile,joy
