ID,Text,Label
473,i feel as if eventually im not going to care about anyone else that im going to become hateful towards everyone not necessarily because they did anything wrong but because they didnt notice the pain that im in,anger
474,i feel require stood twains stubborn things the clothes of less charge the front page allow asphalt compactor eccentric system weight take over more segment those soccer drill for beginner scrambling for a road name long hot summer,anger
475,i know that they were once someone else s it would feel rude to just toss them off,anger
476,i go in i never feel rushed and feel like i am being paid full attention,anger
477,i cannot see her in my mind without feeling enraged by the absurd torture we put each other through,anger
478,i got home this morning feeling extremely grouchy after a long drive without my sirius reciever and she presented me with the little box,anger
479,i had been feeling irritable just a half hour before lacey and i reached my moms place,anger
480,when i was refused a transfer from my school to another,anger
481,i will deal with her as i feel her conduct to be highly dangerous and damaging to the mind,anger
482,i feel so pissed off over an old friend and some friends,anger
483,i am feeling just a tad and im being really sarcastic here pressed for merriment and joy,anger
484,i feel less of a person because of it and then i put up this wall this bitchy wall,anger
485,i think the scenario was some sort of invasion of body snatchers things as i get the feeling we were trying to avoid some people and more and more became hostile,anger
486,i sometimes feel dissatisfied with my life i see christian and it seems he has it worse off than me,anger
487,i feel more than a little impatient with people,anger
488,i would feel offended and as well embarrassed,anger
489,i let out a shiver but i didnt feel to cold,anger
490,im annoyed because i feel annoyed,anger
491,i feel so disgusted with every sight and inch of myself,anger
492,i feel like i need to see what he looks like when he s angry so i know not to make him angry,anger
493,i feel in some way like i got greedy with my luck and look where it got me,anger
494,i look at momade s cuts any longer i might throw up on him but i feel really rude walking away,anger
495,i love without questioning when it s love i feel i don t hate though i will get angry and flustered with people if i dont get what i want or the way i want it,anger
496,i found myself feeling enraged fearful and helpless all balled up into one,anger
497,im hurt perhaps by another bahai that i feel wronged me in some way,anger
498,i feel like a greedy person,anger
499,i feel so violent so vulgar,anger
500,i feel it terribly impolite the bore the shit out of kind folks who had the unfortunate luck to be dragged into a conversation about writing with me a conversation i could have for approximately hours before tiring,anger
501,i just feel the bitchy need to report it to you for trial by jury,anger
502,i thought i would feel resentful and angry when my alarm went off in the morning,anger
503,i too am in perpetual motion all this demands a high level of tension but it gives me a feeling of violent almost vertiginous happiness,anger
504,i feel annoyed as if the world if taunting me,anger
505,i feel violent when i watch it,anger
506,i kinda feel bitchy but im turely sad,anger
507,i would point out that there is a way also to draw a measure a measure that americans will have a different feel for when i lay out the casualty rates for violent deaths in our cities in america,anger
508,i feel that i may have unintentionally offended you during our conference call today and if so i apologize,anger
509,i feel i rushed the first one,anger
510,i don t usually take my medication in the middle of a job given that it is supposed to help me forget but i ve been feeling distracted,anger
511,i can tell you the girl would have strangled you by now not only because you have cheated on her feelings but of another females which makes you a heartless jerk,anger
512,i feel like such a cranky old woman every time i try to fire up a new game now because i reminisce about the good old days when you put the disk in and away you went you didn t sit around waiting for bullshit downloads,anger
513,i should feel furious mad sad depressed,anger
514,i feel i owe it to cob higgins and petty officer holtz,anger
515,i feel as if its trying to be dangerous and dark but it fails at least to me to a big degree,anger
516,i still feel a pang of guilt when i m unkind or selfish when i do something i feel to be unethical for the most part the gripping guilt of religion isn t something i expected to feel again in my lifetime,anger
517,im also feeling stubborn about the fact that i would really like my engagement ring to cost more than what my rings from moon angel cost otherwise i should just get another ring from moon angel and be done with it,anger
518,i left all that well alone in the last decade and did a little something on jessie j i feel a bit like a come dine with me contestant who got too pissed when they did the scoring and gave a,anger
519,i want you to feel like you can joyously sing and dance and everyone will clap which they will i want your mom to stop making me feel violent i want your mom to be sweet like candy,anger
520,i understand it is if you fail and you feel jealous of other people you dont have the right to feel jealous cause you didnt work as hard as them,anger
521,i know some people drive a long ways to get to their jobs and i feel like im being a little greedy here looking for another position,anger
522,i am a bit depressed and feeling fucked up,anger
523,my parents were having a typical family argument i came in and saw the scene and became angry,anger
524,i was still feeling aggravated with myself everything,anger
525,im currently feeling very irritable and a little irrational,anger
526,im glad turtles cant talk or have feelings of resentment and a sense of being unjustly wronged or sue,anger
527,i spent most of it feeling pissed off see the last post about me being bitter and its kind of just carried on into the week,anger
528,i feel your greedy hands are cold,anger
529,i feel annoyed too when people don t show confidence in me,anger
530,i could probably just do two separate finds and iterate over them to merge them together but im feeling stubborn and want this to work,anger
531,i really don t consider them to be a part of my life now but they were a huge part of my adolescence and i feel would be offended if i don t invite them to my wedding,anger
532,im feeling considerably irritated and confused by how easy it is to notice something has gone missing,anger
533,im feeling a bit grumpy and frustrated tonight so decided maybe an early bed time and early morning work out maybe the change i need,anger
534,i just feel too much and i care too much and i get bothered too much,anger
535,last night finding that someone in the house had eaten an entire packet of almonds i had bought for a family treat,anger
536,i still feel like a letter from someone hated by most of the students myself included is certainly worthwhile to have,anger
537,ive always had the very stabilizing feeling that theres a load of seriously fucked up bigoted idiots out there and i dont have to take what they think of me personally,anger
538,i don t feel resentful at x for lashing out at me,anger
539,ive been mad at someone or feel insulted by them caleb has gone out of his way to be nice to them,anger
540,i feel resentful that balint micromanages my food and even though im grateful for his efforts im equally resentful that he does because i want to eat,anger
541,i because im feeling impatient and all this longing to have a baby,anger
542,i feel like an angry gorilla all the time and always ready to chew someone s face off,anger
543,i just saw my work schedule for next month and im left feeling frustrated,anger
544,i feel so mind fucked right now,anger
545,i find it interesting that carlson is offended and feels that gundy has wronged her,anger
546,i was feeling a bit grumpy this morning so i pulled up my humor file and found this that my husband had sent a while back,anger
547,i feel like becoming violent,anger
548,i feel lied to and pissed,anger
549,i know how she cut things off with our co worker al and i know how she words things when she wants to spare feelings and ease things so things do not completely become bitter,anger
550,ive been feeling a little stressed this week and i really need a kind little snail on my shoulder to remind me about these simple things i can do to improve my life and my art,anger
551,i have a feeling im repeating vicious cycles and i cant stop myself,anger
552,i started to feel like i was going mad as i was sure i could see stars floating in the water but whenever i went to grab one i came up with nothing,anger
553,i came up on miles i was starting to bonk out a bit and me left knee was starting to feel a bit aggravated,anger
554,i feel toughed or angered or concerned about something that i really feel like sharing,anger
555,i suppose on days when im feeling grumpy tired and spread too thin its even more important to put i thessalonians into practice,anger
556,i got past the sick feeling in my stomach and got mad at the situation instead of just at myself,anger
557,id work on this relationship but right now i feel were being petty both of us i mean,anger
558,when my friends left without waiting for me,anger
559,i am feeling quite cranky towards them,anger
560,i dont know why the hell i feel so violent lately though i have my theories but my fingers itched for the feel of a gun or a sword,anger
561,i pretty much feel like a heartless bitch,anger
562,i didn t want my feeling to be offended and opt not to return in the future,anger
563,i feel agitated and empty and missing something,anger
564,i feel like ive been fucked over dry,anger
565,i will hope she experiences the thrills of running to catch buses and feel the frustrated tears that flood ones eyes after missing buses,anger
566,i believed this story for so long that i didn t eat a topic bar until my twenties turns out their pretty good and now i buy them when i m feeling dangerous,anger
567,i get the sense that you re feeling irritated today,anger
568,during my childhood when i could not get what i wanted from my brothersister and parents,anger
569,i have to stay creative or i feel i will go mad,anger
570,i read her post i thought about how differently that night could have gone if they were feeling a bit more selfish,anger
571,i could not shake the feeling that the framing of shots was perpetually a bit out of whack almost as though filming was so rushed that oplev had to content himself with merely plunking the camera down haphazardly,anger
572,im still feeling so wronged and upset about it,anger
573,i was tired of walking couldnt really run and feeling irritated with myself,anger
574,i feel violent to a certain degree of wanting to protect my personal space,anger
575,im feeling very bitter against knight in shining denim because i asked him a year ago to go to the gym with me and he wouldnt spend the money,anger
576,i feel the cold nights thinking of the old nights spent along with you,anger
577,i arrived at the school i was already feeling the pain on my knees but i was appalled and shocked when i saw two wounds bleeding,anger
578,im not criticising anyone right now but i really feel disgusted talking to those people who have no respect for themselves,anger
579,i feel violent rash and a burning sense of damnation within me,anger
580,i was feeling a little bitter,anger
581,i find i am feeling quite resentful when it comes to sex as i feel that he is being extremely stubborn and hardheaded when it comes to our sexual relationship,anger
582,i use to think about you guys when you guys would just randomly appear in my life or when you obnoxiously post photos of you kissing dudes or what ever on instagram i use to feel bitter and sour,anger
583,i never brag but the ache in my groin is becoming painful and i m feeling spiteful,anger
584,i feel a blast of cold as the freezing air and rain sweeps in from the outside,anger
585,i hate the feeling when i get jealous because i dont like,anger
586,i start feeling cranky tired,anger
587,now that the ers are winners,anger
588,i started to not talk to him that much because i feel betrayed i am disgusted by his actions,anger
589,i didnt care was she was feeling i didnt know her and on top of that i was jealous she was getting johnnys attention at all,anger
590,i feel insulted by that,anger
591,i was beginning to feel stubborn,anger
592,i have is emotional blabber that pours out of me and then i have feelings and i don t know what to do with myself so i get angry,anger
593,having agreed to share the taxi expenses,anger
594,i feel like everytime i try to do anything i am distracted by something else,anger
595,i just feel this petty anger at all the mature people in my life because i feel that they are smug,anger
596,a drunk walked out in front of a car at night both lower legs were broken his shoe was thrown about yards after the accident,anger
597,i feel like i must vent my anger unhappiness somewhere other than telling my friends because i feel very bothered by it,anger
598,i try a few more times to get in to the white noise and brain wave sounds and really feel agitated and unable to just let go and relax,anger
599,im feeling very rushed for time here with only a few days left,anger
600,ive been feeling dissatisfied,anger
601,i was feeling more than a little apprehensive anticipating teaching in a christian school but scclc is unlike any other christian school i ve ever experienced before,fear
602,i was feeling pretty vulnerable though,fear
603,i feel so shy right now haha,fear
604,i wake up and feel a moment of hate for those who tortured me and enjoyed it,fear
605,i feel very intimidated by this government and i m not a woman who s easily intimidated she says,fear
606,i feel that the nd s is a pretty shaky one but i tried,fear
607,i know that when i am around certain skaters and coaches i feel threatened by them and i am on alert with respect to them and need to work extra hard to focus on the job at hand,fear
608,i still feel shaken and it was only an hour ago when i stopped crying,fear
609,i know when i am overwhelmed with circumstances or situations happening in my life the pressure adds to my feeling of being unsure,fear
610,im feeling so unsure when things are pressing in about me comes a gentle voice so still,fear
611,i feel hesitant and uncertain as to what to write almost fearful and watchful of what im typing,fear
612,i started to talk and could feel my voice getting shaky,fear
613,i know from my guy friends that single guys are facing similar dating issues they feel like they are no women out there who arent neurotic or bitchy,fear
614,i was driving very fast on a small road and i met an oncoming car in a right handed bend the other driver was on his own side of the road and i had to skid out of it to avoid a collision it was dark,fear
615,i never ever have to feel terrified or discouraged,fear
616,i feel terrified but anything is better than feeling dead inside,fear
617,i feel very uncomfortable around people with down syndrome,fear
618,i feel a little doubtful and,fear
619,i want to know how people are feeling and if there is anything they are as confused as shit about before i move on,fear
620,ive disconnected myself from situations that make me feel uncomfortable,fear
621,i feel vulnerable and exposed and all i want to do is run and hide,fear
622,i even feel that some else is having your attention or maybe im just paranoid but think why would a girl have paranoid issues,fear
623,im really feeling a bit unsure of the results and i reckon if i was to get another set and start again id probably do it all differently but alas hindsight is mankinds eternal curse,fear
624,i am feeling pretty shaky and sad,fear
625,i just feel so shaken,fear
626,i feel uncertain about my ability to know or understand hopeless in my ability to change or lead i feel overwhelmed by the act of existence,fear
627,im feeling pressured hell lot of pressure,fear
628,i woke up around pm and was feeling restless so i got in my car and started driving,fear
629,i shrine in samarra on february and the ensuing sectarian violence primarily between sunnis and shias has changed the way many iraqis feel about the concept of one iraq and i m skeptical that those changes can be reversed,fear
630,i feel more scared and uncomfortable then i am laughing,fear
631,im feeling unsure of myself much of the time i start doubting myself,fear
632,i am not feeling too nervous because my friend fran from the universe had calmed me down but damn i can t turn my neck,fear
633,im feeling most vulnerable dark and hopeless i tend to sync every bad thing that is occurring in my life and put the good aside,fear
634,i know what i feel so even were uncertain im not hiding not furtive,fear
635,i me is that i feel shaky,fear
636,i should shoot for i feel even more confused,fear
637,i got this kind of cool edgy feeling from this top especially with the distressed holes on the side which you can faintly see in the picture,fear
638,i am already calm and happy but when i m feeling under stress or distressed i get so caught up in that that i forget that i have a tool at hand to help me,fear
639,i bought the rowan studio crochet book thinking id make katelyn and bought some lovely mustard coloured yarn but i still feel a bit anxious about attempting it,fear
640,i am feeling a little paranoid right now,fear
641,i feel almost as though he might have been frightened to meet morgan,fear
642,i feel distressed whenever i don t blog for so long as there s something about the love of your life pinching you on the sides yet you ignore it,fear
643,i am feeling skeptical today,fear
644,i feel shaken to my core with this recent movie theater shooting,fear
645,i hate damaged hair and the way they feel like so thats probably why im hesitant to colour it apart from mom forbidding me to,fear
646,i know and i feel frantic,fear
647,i was feeling afraid at this stage honestly thought my brain was about to be done with,fear
648,i only have a few seconds to write as i am feeling very frantic with the pile of papers on my desk,fear
649,i slept together because we both feel incredibly vulnerable about the fact that you re leaving again,fear
650,i feel as if there are absolutely no reasons for me to be so terrified and yet i am,fear
651,i guess i just need to see how it goes so while im feeling very nervous im also very excited,fear
652,i do have to be careful not to eat too much now otherwise i will feel pretty uncomfortable afterwards,fear
653,i worked up a sweat increased my heart and breathing rates but i didnt feel distressed in any way no wheezing or anything,fear
654,i admit that more often that i would like i feel confused in battle scenes but still i would say that i like or even love them in my fantasy readings,fear
655,i always feel a tad intimidated when i post there,fear
656,im getting invisalign so i will be feeling rather apprehensive about going in,fear
657,i feel reluctant then to comment on some of the more complex themes at play in black swan such as parental influence and sexual liberation,fear
658,i feel insecure every day of my life but thats become just a part of my daily life now thats nothing new,fear
659,i said last night to my girlfriends that i feel kind of helpless especiallly when it comes to my weight and rachel said you should write about it it always helped you to keep track on your blog,fear
660,i go lower than that for a few consecutive days i start feeling shaky agitated etc and it doesnt get better with time,fear
661,i kind of feel like a failure in that department but she was so so so timid if you spoke anything to her other than russian or ukrainian,fear
662,im not feeling fearful just anxious,fear
663,i find that im feeling petrified and strange for this girl ive never met,fear
664,i feel so indecisive about everything still,fear
665,i can eaaaasily run over there and even back if i feel distressed of the outback lifestyle,fear
666,i feel myself terrified of what other demon would take its place,fear
667,i somehow feel more vulnerable without it,fear
668,i feel shy going into stores i feel like such a waegook and how i can t really speak korean gt,fear
669,i am feeling much more then i have in my life and it is so strange to feel anger or fear and not shut down emotionally or mentally to protect myself and the others around me,fear
670,i sometimes feel hesitant about movies based on steven king stories,fear
671,i had gone for a medical checkup at the uth and failed to make it back on time for the c practical sessions at hours last academic year,fear
672,i know i can do things to keep myself calmer and feel alot less frantic,fear
673,i feel scared attacked and manipulated,fear
674,i really was just feeling unsure and insecure,fear
675,i am having some blood sugar issues this afternoon and i feel all shaky and hopped up and so if this post is a little heavy on the caps i just wanna say sorry,fear
676,i feel scared because theres actually nothing there to be scared about,fear
677,i was feeling pretty paranoid as i rode the last mile or so down carrollton avenue in traffic,fear
678,i might believe that im in an intellectual state of mind only to realize that i feel afraid inside,fear
679,i feel hesitant i just want him to feel loved,fear
680,im not quite sure when things changed but i know i boarded the international flight to malaysia feeling slightly apprehensive but mostly excited,fear
681,i am feeling a little suspicious cuz she is now less than ft away from me,fear
682,i still feel scared and he wraps me around tighter,fear
683,im feeling a little reluctant to embrace this youthful trend,fear
684,i really feel hesitant to write about nothing but bill,fear
685,ive learned i will fight fiercely to avoid feeling vulnerable,fear
686,i feel shy when people shout my name,fear
687,i fall behind on dishes folding clothing sweeping or sorting paperwork i feel distressed,fear
688,ive been feeling is shaken at my core,fear
689,i feel like myself just a much less neurotic and sometimes less energetic remix,fear
690,i still feel uncertain about my work but it s only been one semester,fear
691,i do feel a little shy when it comes to having peers read my paper,fear
692,i had to go around feeling paranoid that he d blab to our friends and they d think me silly or lonely or petty or all of the above,fear
693,i feel so unsure about us,fear
694,i feel paranoid lonely moody fuckedup and pissed off very often way too often,fear
695,i still feel reluctant to spend rm to see a doctor,fear
696,i feel shaky and pretty weak,fear
697,i feel pressured i misspell and i leave words out and my thoughts get jumbled one finger typing is tedious and my poor finger gets worn out,fear
698,i feel so confused lost and hurt,fear
699,i feel a bit frantic as i am starting out this blog trying to get people to pay attention but honestly if people like it or do i will still keep writing and being true to myself,fear
700,im sick of feeling pressured to prove myself and joeys ability via training and shows,fear
701,i was feeling by putting them onto canvas my lack of emotion frightened me,fear
702,im guilty but i have a feeling thats what theyre thinking especially because they are suspicious of me after my supposedly malicious comments the other day,fear
703,i want to wear but can t wear because i m not a size or then yeah i feel pressured to be skinny,fear
704,i feel like such a little wimpy girly man at work cause im not allowed to lift more than lbs,fear
705,i feel mildly terrified by ramsin canon,fear
706,i no longer feel restless with silence around me,fear
707,i didnt want to feel peer pressured into a handmade christmas because thats the kind of pressure only thrown at women and that drives me a little nutters,fear
708,i hope thats what youre all thinking honestly im still somewhere in between part of me has calmed down since that episode while part of me is still feeling just as uptight as before,fear
709,i have seen that a father or some person in the family generates so much negative vibes in his home that the other members of the family feel uncomfortable when that person comes home,fear
710,i feel very frightened that i cant get thru this,fear
711,i feel that now im out here im more confused by it as ever,fear
712,i feel about the decision to divide the community along pay to play lines until this point it s been a direction valve have been reluctant to travel and with good reason,fear
713,im feeling frightened and a touch of despair,fear
714,i never told anyone to think that i woke up one day and have that familiar feeling anxious restless until i could go to a store decoration of clothes jewelry or home,fear
715,i feel really agitated and confused about something say for thirty minutes and in that i feel like im analysing everything around me,fear
716,i got a feeling tt i m gonna breakdown in any moment if i am agitated,fear
717,i am trying to sleep or sometimes when i have a particular dream i go through this strange and st times disturbing episodes where it feels like i become obsessively fearful over the most trite things like whether or not i will wake up in time to get to class,fear
718,i think it is time especially between women that we celebrate and be inspired by each others strengths instead of feeling intimidated,fear
719,i am feeling really scared says ali akram hayat a student of lahore grammar school who has been selected besides four others to represent pakistan at the world schools debating championship in south africa,fear
