ID,Text,Label
251,i feel that creative fire and sometimes i feel nothing at all a hollow where before ideas snuggled up together and percolated one by one through the filter of my waking mind,joy
252,i feel like he has a very pleasant nearly transparent presence on lobelia though that presence was necessary nonetheless,joy
253,i am sure if one romance rekindled like the way angel did stoic can even feel the feel and yet this time so much to reveal as i just got divine bliss,joy
254,i did feel like accosting this ridiculously handsome couple that i passed on the sidewalk yesterday,joy
255,i start to feel joyful seem to be hit by life,joy
256,i feel in a very graceful way,joy
257,i left uganda i was feeling pretty fed up,joy
258,i feel confident in the thoroughness of the doctors and in the fact that they wont hesitate to send us to boston if they feel they are in over their heads,joy
259,i make myself feel energetic and superior and more than and a href http eqafe,joy
260,im feeling peaceful and blessed and very grateful tonight,joy
261,i was feeling very overworked and i wasn t really that pleasant to be around,joy
262,i feel honoured to be asked to chair this lecture,joy
263,i love and it brings me absolute joy to stay up editing photos everyday til the wee hours of the morning because that feeling when ive freezed a perfect moment that feeling when i realize im proud of a photo ive taken that feeling,joy
264,i was used to coming out of the shower and feeling instantly like my hair was in a fab condition but these products definitely took a couple of days to settle down,joy
265,i feel fine a href http alexfeldstein,joy
266,i received this script and i thought it was really funny and unique and new so i auditioned for it and ended up getting the part and i couldn t be happier or feel lucky it s so much fun,joy
267,i settled back onto my knees not sure if i should feel relieved,joy
268,i do to make he believe me that my feelings are sincere,joy
269,im feeling a bit more positive although still tired and achy,joy
270,i feel the amount of intelligent jokes decreased significantly,joy
271,i feel it wont be that pleasant though im not worried about this secret how about you,joy
272,i think this is good legislation and with the help of the inspector general s office the residents of yonkers will be able to feel assured as the city enacts more safeguards to discourage inappropriate transactions faulty records or the more dastardly case of outright embezzlement,joy
273,i feel like if things are determined by the universe or the universal balance or whatever i have a safety net,joy
274,i was expecting way too much out of myself by trying to feel happy and awesome,joy
275,i feel carefree i feel very at ease and i feel like myself,joy
276,ive been spending a lot of time in my sewing room again and it feels wonderful,joy
277,im thankful that i feel that much more obscenely proud than jealous of said ass kicking friends,joy
278,i am feeling incredibly thankful for my family,joy
279,i was pretty sure i was dying but today im feeling more optimistic about survival,joy
280,i need to feel like what im doing is worthwhile to someone else as well as me,joy
281,im feeling glamorous,joy
282,i have a feeling its gonna be pretty cute,joy
283,i used to race with the sun feeling life running through my veins being carefree after some not so much happy years,joy
284,i come to paris i feel so welcomed by the whole city,joy
285,i feel like i m still just getting started and there are many ideas and directions i m eager to pursue,joy
286,i see cute boys i get so elated i feel like im so delighted and my eyes literally turn heart shaped like in cartoons,joy
287,im not feeling cute funny or witty this evening,joy
288,i feel the most inspired where i am the most peaceful and where i go to remember what is important,joy
289,i do feel that the song is a lot more festive both in the way it sounds and the video content which can only be a positive,joy
290,i thought this was a profound thing to say because in this day and age people still look at hiv positive people in a funny way and feel pity for them convinced that they are surely dying slowly,joy
291,i didnt feel a spark necessarily but he was cute and was fun to talk with,joy
292,i feel comfortable within my skin,joy
293,i can say with certainty that minutes after you finish eating you will be full and satisfied and you will also feel fantastic,joy
294,i was drafting i wasnt feeling creative enough to do without this but if someone can figure out a way to eliminate it while still giving us appropriate negotiating parameters id welcome the suggestion,joy
295,i used to feel like no one would ever like me because my hair is not super long and because i am not skinny,joy
296,im keeping my notes just in case i feel inspired to go into greater detail about this one in the morning but i doubt thatll happen,joy
297,i feel like im on a days a week pms not very pleasant if you know what i mean,joy
298,i feel so glad ive emilyn amp melinda with me throughout all these times never throwing me away when they dont need me,joy
299,i almost didnt even feel convinced by the way the book was written,joy
300,i feel very privilaged to have the opportunity to work with these incredably commited and talented artists,joy
301,i knew he was feeling horny so while sitting near him i opened his dhoti and stated mouth fucking him,love
302,i feel like for me it brings loving to a whole new level,love
303,i now feel terribly sympathetic towards parents of children who are behind their peers in reading because i suspect its easy to feel guilty or blamed,love
304,i will update you briefly on me and how im feeling and then i will leave you with some lovely egg images,love
305,ive gotten the feeling that my friends arent that supportive and are more competitive with me always trying to best me at things,love
306,i didnt feel like you were being supportive and happy for me,love
307,i wish i didnt feel the need to be this loyal,love
308,i wonder if she s going to mark me again my stomach fluttering at the thought conflicted feelings but her touch remains gentle barely there at all,love
309,i feel the pain carves me with it s knife only you can make me see it goes on and on confuses my mind i m longing for tomorrow to leave the past behind,love
310,i have definately learned that no matter how umprepared we may feel god is faithful and will work things out for his glory,love
311,i think the heart is completely ridiculous because t makes me love and feel all the emotions that come with loving another living being,love
312,i feel with the capacity of a producer and an actor someone like david would be far more accepted when he comes onscreen and shows boxing in a different light,love
313,im looking forward to moving and having more space being closer to daves work as well as friends and family i am feeling very nostalgic about leaving,love
314,im friendly with a male i just feel the need to be affectionate,love
315,i know those cobbled streets are normally home to kebab eating drunken maniacs that make you feel as if youve gone on a lads holiday to kos by accident but le qg do really lovely mojitos and during happy hour pm every day they are euros,love
316,i turn to my left and feel the hot muzzle of a gun pressed against my forehead,love
317,i definitely feel loved i guess my second love language would be gifts,love
318,i went home fortunately i hadnt gone home and left again and as i was feeling ragingly horny was checking my messages and ended up swapping messages with a guy who had been sending me rude messages and just kept on hitting the nail on the head with exactly what i like,love
319,i really stubbornly want our bikes with us i love our bikes and honestly i feel pretty loyal to yuba i dont want any other bike damn it,love
320,i feel very slutty compared to her,love
321,im scared please protect me to which the normal male response is to feel more affectionate and sympathetic towards the individual for whom he has accepted the responsibility of protecting,love
322,i feel like you are not caring enough of my circs,love
323,i daydream about quitting my job and doing something entirely different because i don t feel passionate about my work anymore,love
324,i had to announce it to my mom and i feel like im not caring for the stuff im given enough and that im somewhat unworthy of getting anything else of value from my family,love
325,i mean feeling you up doesn t feel supportive to you,love
326,i feel like my loved ones want to just put me in a box and ship me off somewhere until i see things the way i used to,love
327,i feel very loved,love
328,i use to watch and laugh at people while they were feeling pain or were soon to be killed because i grew up only caring about my grandparents,love
329,i think i am not unique in my powerful feelings for this city loving concern for its health and wholeness immense pride in its contributions to humans musical legacy awed gratitude for its part in american art and culture,love
330,i understand that there is a place for support groups and rants and anger but there needs to be room for something else and i no longer feel particularly accepted there,love
331,i feel quite tender and what is this,love
332,i feel that this is an underused topic especially when so many movies even disney movies put more of the focus on romantic relationships than family relationships,love
333,i save the smaller ones for my ass but if i am feeling really horny a nice hard carrot will take me where i need to go,love
334,i feel like he was trying to be supportive,love
335,i wont be totally satisfied until i feel like me and my work actually means something to more than my loyal reading viewing audience,love
336,im starting to feel sympathetic towards the robber now,love
337,i would feel the hot moist eager mouth as his lips and mine pressed together in passionate union and i would think of and feel many other bodily sensations and responses to his touch and presence,love
338,i recall them i am feeling fond of the memories how i was growing into my own independence at the point in my life and how it helped shaped some decisions i would later make about moving out of my home town,love
339,i feel the delicate separation of each muscle the ripples and bumps of old injuries nursing them back to smoothness,love
340,i feel romantic emotions over something non romantic,love
341,i have a feeling it meant more to her i could see a reflection of myself when she looked at me how i looked at other guys that i liked,love
342,i know everything that i want in a person but every time my feelings take over caring feelings and i cant stop myself and feel that i want to be with that person even though i know that theyre missing some key things that i feel i need,love
343,i could feel her ache her longing to embrace my words,love
344,i can feel it even with gentle walking,love
345,ill know who i am and not feel the need to emulate others behaviors to feel liked and accepted,love
346,i feel like ive been accepted into a community here in my new town,love
347,i did feel treasured by him,love
348,i was feeling very romantic a few minutes ago ugh,love
349,i feel extremely passionate about is a href http www,love
350,i am imploring people to respect my talented sons memory and feel compassion for his loving mother sasha,love
351,i see people who i do not particulary feel sympathetic to on the news that have lost everything to a tornado and they start crying or carrying on i feel my heart strings moving and tears will start running down my face,love
352,i can tell she has feelings for you and i know she loves the dog she s been caring for,love
353,i can clearly understand from a mum who has been trying over a year and i feel for those who have that longing to bring another baby into the world but are having great difficulty a href http www,love
354,i feel the movie was really about getting canadians fully on board with supporting the war more than it was to get americans to join,love
355,i enjoy feeling passionate about somethiing it makes me feel alive,love
356,im feeling cabin fever gt nowhere in groupons romantic vacation deals for two fineprint says it needs to be fulfilled by loveydoveys see where im going with this,love
357,i used oz and didnt feel like i was being generous with the chocolate at all,love
358,i wish you a good start on a new year coming and may you always feel the warmth and loving you deserve,love
359,i kissed my mother good bye as i made her drop me off away from the other kids so that it made me feel at the tender age of that i was a grown up,love
360,i wish to know whether i should feel sympathetic towards the airline american if say their plane is on fire or their pilot has exploded or whether i should want to set them on fire if say they just decided to walk on their obligations to save money,love
361,im not feeling so slutty tonight as much as pouty,love
362,i fall in love i want to fall for someone who will make me feel that loving him is the greatest decision i ever made and not just another mistake i always have this fear that one day you are going to discover that im not as great as you once thought i was,love
363,i feel snape is loyal to no one but himself,love
364,i think i rubbed it in my sleep and it feels tender,love
365,im feeling nostalgic this morning im going to link back to my post on november,love
366,i know it wont ever be like but i just want that feeling of caring back,love
367,im feeling really romantic and cheezy after watching the full season of the st shop of coffee prince,love
368,i who are feeling a little amorous this week by reading this sexy book are just going to have to wait until we get home to get a little romance,love
369,i feel like they are just trying to be blindly supportive,love
370,i feel the call to detach myself emotionally from caring so deeply about both the process and the outcomes and to surrender myself completely into gods hands leaving everything including the process the outcomes and the timing up to him,love
371,i both had a feeling she was a girl but would have also loved the idea of brothers,love
372,i really want to switch to as much as ive enjoyed this blog is a blog dedicated to type diabetes because that is what i feel truly passionate about right now,love
373,i think that is the same thing because when you have feelings you are more considerate to others because you know how you would feel and wouldnt want them to feel as hurt or as confused or hmmm,love
374,i feel like there is no point in caring for my body because it is not the body i want,love
375,i had been feeling hot all day the first day and also into the evening,love
376,i was feeling nostalgic so i went and watched older videos and read older bn posts and heres what ive noticed about this guy there was a time when he did things perfectly e,love
377,i feel i should have liked much more than i actually did,love
378,i am still feeling rather tender over the duplicity and don t think i can report about it in a logical or clinical manner,love
379,i feel it was just a nostalgic journey for me that made me think of those rare instances where you win at the end of the season,love
380,im feeling nostalgic ill share it here,love
381,i feel birth and caring for a newborn is not something you can read about and control,love
382,im done massaging them my nipples are so hard and i feel so horny that i cant help but moan and imagine you fucking me from behind while you mash my two big boobs,love
383,i feel that ive met people who are genuinely caring and its touching that someone who is on the other side of the world would be so open and honest and bother about how im feeling,love
384,i feel like they draw attention up to your face and can sometimes frame your shoulders and collar bones in a lovely way,love
385,im feeling naughty or im feeling extremely lonely,love
386,i call her a mean name it means i am feeling especially affectionate towards her,love
387,i feel myself longing for eliza even more,love
388,i started to feel hot all over and could barely swallow,love
389,im not a very romantic girl since my heartbroken but i can truly feel and its my fault wanting the sun when its so far from earth to reach it and to hot to touch it,love
390,i do not feel they are caring enough about the flooding that will occur even after the storm on sunday,love
391,i feel about him even though i have a feeling he knows that i liked him at some point,love
392,i feel his little body melt and relax and he lets out a little sweet sigh,love
393,i was i met my boyfriend and dm was his favorite band and he gave me everything the ever did and i feel in love with them al over again been hoplessly devoted ever sence getting worce but the month,love
394,i have a feeling this one may take some time but so farim loving it,love
395,i cant deny that the picture above does make me feel a little nostalgic for home but it does leave out some of the key elements that make the north such a special place in my heart,love
396,i feel it is my duty as the owner of the manchester dungeon to not only join in but to show them how naughty is really done,love
397,i inhale the scent of pine needles and earth feel the sun on my face and the gentle breeze in my hair experience the grandeur of being a part of it all,love
398,i just hate feeling like i m not enjoying or loving running anymore because of some awful runs,love
399,i just wanted to tell you that even if general o neill hadn t asked me to look out for you i wouldn t let you go suddenly i m feeling really sympathetic to you and him and i can t believe you ve spent thirty some odd years apart,love
400,i feel sympathetic to a group he may see as unworthy fallen angels he might at least be able to shed some light on how i can come to terms with this after being taught differently,love
401,i started to feel all slutty and dirty like some sort of hoodrat so i had to constantly check myself just like i had done my whole childhood,love
402,i will never feel the warmth of a loved one against my skin,love
403,im taking a study break and feeling so nostalgic and blessed i decided to do a little recap post of this year,love
404,i could feel the longing and feeling of the characters through their speech and they really became the characters they were conveying to us,love
405,i dont know how i feel about that i really liked one and two,love
406,i feel like any student response can tip the delicate balance of my psyche,love
407,i really loved that sweater and it makes me feel all tender and nostalgic whenever brobee comes on the screen,love
408,i find that despite the fact that i feel like i really liked this book i certainly read through the entire thing like i had a physical need to find out what happens next i cant think of anything to say about it,love
409,i feel a gentle caress on my hair which i make an effort to keep soft,love
410,i would not have told him or even joined the company had i not had a feeling he would be supportive,love
411,i feel she actually liked dad,love
412,i feel hot wet tears on my cheeks,love
413,i feel at times as god tries to teach me to give up my un gentle ways to be more tender,love
414,i spoke to the tutors that i feel i can confide in and they are so supportive,love
415,i feel that we had a lovely time with the best bit being able to be together as a family,love
416,i am comfortable when im with him and yet as we go home i feel this longing to be with him again,love
417,i say the only way to justify myself that i can think of is blaming this moody feelings to my passionate nature i feel what i feel and i cannot change it,love
418,i feel like i talk about xavier too much but i just really like that program and what they do year after year and i really really like tu holloway although i liked him better when he went by terrell,love
419,i feel causes have caused me to stop caring as much,love
420,i left it on for a bit longer than five minutes and it was dry and easy to wash off leaving my skin feeling lovely and soft,love
421,i was feeling very loyal to the horde after trying out a couple of human characters and swiftly deleting them but the dwarf i tried out is cute and ive kept her,love
422,i have still been feeling pretty delicate although im slowly getting better,love
423,i hate that i feel that we are on a delicate schedule with very little wiggle room,love
424,i feel the earth s heartbeat slowly begin fade distinctly into a gentle tapping sound and then it magically disappears,love
425,i did feel a longing to have the book in my hand though except when i was listening and driving,love
426,i know frying is not healthy but lately i have been feeling naughty so i fried these babies in vegetable oil and served them with a light dash of creole seasoning,love
427,i feel that over the years i have nurtured this compassionate side with the help of others,love
428,im feeling very naughty tonight but it is so funny,love
429,i walk by animal stores or see people walking their pets i feel a sense of longing for my own animals,love
430,i feel your hot breath on my ear as you press me against you and my left hand reaches to caress your cheek,love
431,i feel horny serena pointed out logically,love
432,i remind myself that the bad mood will be more intense and longer lasting than the good taste and short lived good feeling of that sweet that is calling my name,love
433,i feel that one of my strongest traits is my compassion for others being compassionate is unfathomably important to me as it is the grounds from which i stand,love
434,i even feel nostalgic for that night we slept on the front porch of that restaurant in manchester center to get out of the pouring rain,love
435,i start rounding rd i might not be feeling so lovely towards a big ole belly,love
436,i know its a common feeling but now i cant imagine loving another child as much as i love my little boy,love
437,im feeling heaven this evening bcoz of you my lovely flowers lt class scaledimagefitwidth img height src https fbcdn sphotos f a,love
438,i feel but i never have second thoughts about supporting my football team,love
439,i hope that today you too may get into something that makes you feel fiercely passionate,love
440,i feel like have been supportive lately,love
441,i feel like some people dont know how to be considerate and be open about problems why dont you admit you have a problem,love
442,i feel tender toward those youthful aspirations,love
443,ive been finding it hard to eat things that slim people occasionally eat like cake ice cream pie doughnuts cookies chips without triggering cravings for those foods and a feeling of longing after just one,love
444,i think only we know how it feels like to be longing for all those ibadat that we do everyday,love
445,i feel like theres others who are more passionate i would literally step back,love
446,i might not feel like im beloved but it is a declaration over my body,love
447,i miss reaching back and feeling her there telling her i loved her as the last thing we said to one another each night,love
448,i feel and is sympathetic to what im going through and didnt call me this time,love
449,im feeling generous here are a few of my favorite fall fabric finds,love
450,i feel scrubbing around the edges in a hot shower always does the trick without the risk of accidentally getting nail polish remover on freshly painted nails,love
451,i did not feel saddened enraged or jealous,anger
452,i feel rebellious buying things in bulk i feel rebellious buying things in bulk march am filed under a href http tranquillullaby,anger
453,saw a selfish person doing a selfish thing,anger
454,i don t have my daily consumption of rice i feel a little cranky like a baby without a nap,anger
455,i dont know how to put it into words but i had a feeling of being up against something that was rottenly dangerous,anger
456,i tried it a few times and couldnt stand the feeling of being insincere,anger
457,i did feel that letting her know that something she was doing bothered a large number of people with whom we both socialize amp they had let me know,anger
458,im feeling rude,anger
459,i was just thinking whatever i feel like crap and im grumpy so i just ignored it,anger
460,i feel really really angered,anger
461,when somebody who had been a bully and had acted cruelly to others who were unable to defend themselves was taken down a few notches and he began to grovel i was disgusted with his grovelling and the manner in which he had treated others,anger
462,i feel like i spend so much time being distracted by the people here and the boys and making sure i have someone to hang out with rather than intentionally loving on people for the greater good,anger
463,i just feel so aggravated about this whole subject but mostly hurt,anger
464,i perceived others feeling envious of something i receive or experience and i will do my best to hide that asset from their awareness in the future,anger
465,i feel resentful of the idea that tantric healers are better than the rest of us who provide sexual services and i am sick of religious entities claiming special exemptions e,anger
466,i feel annoyed when they refer to him as the smoking kid,anger
467,i was feeling quite pissed just now as i was accused for nothing again and the worst is by my own mother,anger
468,i feel really petty for what i did,anger
469,i feel rather offended that it did not live to any of my ideals,anger
470,i have a feeling she will be in for a rude awakening down the road,anger
471,i feel a little vicious,anger
472,i ended up with four cats who daily add to the staleness and disorder of my little box in the city and i no longer feel affinity for them irritable as ive become,anger
